{
  "$schema": "../schema.json",
  "formatVersion": 1,
  "id": "call-of-duty",
  "name": "Call of Duty",
  "kind": "game",

  "match": {
    "processes": ["cod", "modernwarfare", "blackopscoldwar", "blackops6"],
    "appliesToGames": false,
    "priority": 10
  },

  "highlights": {
    "Keyboard_W": { "colour": "#FF0000", "label": "Forward" },
    "Keyboard_A": { "colour": "#FF0000", "label": "Left" },
    "Keyboard_S": { "colour": "#FF0000", "label": "Back" },
    "Keyboard_D": { "colour": "#FF0000", "label": "Right" },

    "Keyboard_E": { "colour": "#FF8C00", "label": "Melee" },
    "Keyboard_R": { "colour": "#FF8C00", "label": "Reload" },
    "Keyboard_F": { "colour": "#FF8C00", "label": "Use" },
    "Keyboard_G": { "colour": "#FF8C00", "label": "Lethal equipment" },
    "Keyboard_Q": { "colour": "#FF8C00", "label": "Tactical equipment" },
    "Keyboard_X": { "colour": "#FF8C00", "label": "Field upgrade" },
    "Keyboard_C": { "colour": "#FF8C00", "label": "Crouch / slide" },
    "Keyboard_LeftCtrl": { "colour": "#FF8C00", "label": "Prone" },
    "Keyboard_LeftShift": { "colour": "#FF8C00", "label": "Sprint" },
    "Keyboard_Space": { "colour": "#FF8C00", "label": "Jump" },
    "Keyboard_Tab": { "colour": "#FF8C00", "label": "Scoreboard" },

    "Keyboard_1": { "colour": "#00C8FF", "label": "Next weapon" },
    "Keyboard_2": { "colour": "#00C8FF", "label": "Previous weapon" },
    "Keyboard_3": { "colour": "#00C8FF", "label": "Killstreak 1" },
    "Keyboard_4": { "colour": "#00C8FF", "label": "Killstreak 2" },
    "Keyboard_5": { "colour": "#00C8FF", "label": "Killstreak 3" },

    "Keyboard_Escape": { "colour": "#B4B4B4", "label": "Menu" }
  }
}
